,Title,Authors,Text,Summary,Keywords,published_date,Source
19,Torture in Saudi prisons: 'Most oppressive era we have witnessed',About The Author,"Days after Saudi Arabia announced it would allow women to drive in September 2017, blogger and activist Eman al-Nafjan wrote an uplifting column on CNN.

Praising the tenacity of women's rights activists such as Loujain al-Hathloul, she said: ""Other issues seem conquerable. The biggest issue at the moment is the guardianship system.""

Eight months later, al-Nafjan, Loujain al-Hathloul, and other women's rights activists and male allies were arrested.

They became victims of a widespread online and offline smear campaign, accusing them of trying to destabilise the country and incite public opinion.

Since their arrest, there have been allegations of prisoners being tortured - with reports of lashings and electric shocks while in custody.

Three Saudi Muslim scholars who are linked to the Sahwa, or the Awakening movement, who are reportedly on death row and could be executed in days, are also believed to have suffered in prison.

Salman al-Awdah was hospitalised as a result of solitary confinement, according to Amnesty International, Awad al-Qarni health has also deteriorated, according to activists, while Ali al-Omari has reportedly suffered burns and injuries all over his body as a result of electric shocks during solitary confinement for more than a year.

https://www.aljazeera.com/indepth/features/sahwa-awakening-movement-pressure-saudi-190603100555782.html

Adam Coogle, Saudi Arabia researcher at Human Rights Watch (HRW), told Al Jazeera: ""You have serious allegations of torture by investigators. This is something you will frequently hear from other human rights activists as well.""

Among these prisons are al-Haer in Riyadh, Dhahban near Jeddah, and Dammam in the Eastern Province.

Women's rights defenders, protesters from the predominantly Shia Muslim minority Eastern Province, and other dissidents often stand trial at the Specialised Criminal Court,the kingdom's counterterrorism court.

""Most human rights activists and dissidents are in [both] Mabahith-run prisons or general prisons,"" Yahya Assiri, a Saudi activist who founded the human rights organisation Al Qst, told Al Jazeera.

While general prisons are run by the Ministry of Interior, maximum security prisons are headed by the police agency of the Presidency of the State Security, commonly known as the Mabahith.

Conditions in the general prisons are abysmal and worse than in the maximum security facilities, said Assiri, adding that corporal punishment is common while corruption has fuelled an illicit drug smuggling trade.

""These facilities are far more outdated than maximum security prisons, and cells are often overcrowded,"" he said.

In its 2018 annual report, Al Qst claimed that authorities forced prisoners to sleep in the toilets.

190605093314273

Essam Koshak, an activist and computer engineer was arrested in January 2017 for speaking out against the male guardianship system on Twitter, and sentenced to four years in prison followed by a four-year travel ban.

Though he was tried in the Specialised Criminal Court, he was held in Mecca General Prison before being transferred to the maximum security al-Haer Prison in Riyadh.

Similarly, activist Issa al-Nukheifi was held in pre-trial detention in Mecca General Prison without any charges presented. At the Specialised Criminal Court, he was sentenced to six years in prison followed by a six-year travel ban over Twitter posts criticising the Saudi royal family and government. He is also being held at al-Haer.

Though conditions at Mabahith-run facilities are relatively better, Assiri said that overall, prisons built and administered for detainees suspected of terrorism or other extreme security charges are ""extraordinarily worse than before"".

Although several activists have been temporarily released as their trials proceed, it is expected that they could face 20 years in prison, as per Saudi Arabia's counterterrorism law.

Saudi Arabia has acceded to the UN Convention Against Torture - with reservations, but reports from human rights organisations and testimonies indicate that systematic torture is widespread with impunity.

We have seen this happen before, but not at this kind of scale. It's the most oppressive era we have witnessed. Hala al-Dosari, Saudi scholar and activist

According to Al Qst, while no independent and private visits to prisons have been allowed, there are mounting allegations that prisoners are being tortured during interrogations while being held at maximum security facilities.

Assiri told Al Jazeera that he has documented a wide array of harrowing torture methods, including electrocution, waterboarding and suspending victims from the ceiling by their wrists.

Al Qst's 2018 report said that prominent reformers and women's rights activists Loujain al-Hathloul, Eman al-Nafjan, Samar Badawi, and at least six others, were subjected to ""brutal"" physical and psychological torture.

Amnesty International has said it received testimonies last November of alleged torture of detained women's rights activists, including sexual harassment by masked men, in Dhahban Prison. The victims have claimed that as a result they struggled to walk, shook uncontrollably and had marks on their bodies. One reportedly attempted to take their own life.

More recently, an internal medical document reportedly prepared for the Saudi authorities, intercepted by The Guardian in March, suggested that the health of some 60 prisoners was so dire they needed to be transferred to a medical facility.

The newspaper cited cases of malnutrition and prisoners having bruises, cuts, burns and other marks on their bodies.

""We believe that at least one - if not all - of these reports is accurate,"" Coogle told Al Jazeera, adding that he has documented similar cases in maximum security prisons in the Eastern Province, where political dissidents from the country's Shia Muslim minority are often held before trials and after being convicted.

""We have heard pretty nasty stories about what happens there,"" he said.

Increasing reports of torture being used in prisons come as Crown Prince Mohammed bin Salman, who is commonly known as MBS, prepares to rule the kingdom. The young leader is widely believed to be leading efforts to stifle dissent.

""We have seen this happen before, but not at this kind of scale,"" said Hala al-Dosari, a Saudi scholar and activist at New York University's Center of Human Rights and Global Justice, adding that MBS's strategy is founded on increasing crackdowns in parallel with a global public relations campaign. ""It's the most oppressive era we have witnessed.""

Omaima al-Najjar, a Saudi feminist, blogger, and political refugee in Italy, told Al Jazeera that she has witnessed more self-censorship in recent months.

""I used to frequently read modest critiques of the government in some newspapers such as Al-Watan, but now, you don't see that at all anymore,"" she said, noting the October 2018 assassination of Washington Post columnist Jamal Khashoggi at the Saudi consulate in Turkey.

""There were discussions among ordinary people in public spaces about what happened with Khashoggi,"" al-Najjar said. ""But the conversation came to a complete standstill the moment Saudi admitted responsibility.""

As long as they think they have the US administration in their pocket, they can do whatever they want. Adam Coogle, Saudi Arabia researcher at Human Rights Watch

However, the international community has not been entirely silent, following Khashoggi's assassination and as the Saudi-led coalition continues to attack Yemen.

The United States has issued travel bans against 16 Saudis and their immediate families linked to MBS. A handful of European states, Germany, Belgium, Finland, and Norway, have suspended arms sales to Saudi Arabia and its coalition allies as a result of its actions in Yemen. Saudi Arabia's key arms dealers, the US, France, the United Kingdom, and Canada have not ended sales yet.

Al-Dosari believes these measures are a positive start, but not sufficient to deter further human rights violations. She hopes the international outrage over the Khashoggi scandal and atrocities in Yemen will result in more attention on the kingdom's domestic affairs.

""I think that [the Khashoggi killing] was a moment of clarity for so many people,"" she said. ""It set the record of what the nature of the regime is in Saudi Arabia, even for Saudis - not just the international community.""

Looking ahead, analysts have said that MBS's future relies heavily on the support of US President Donald Trump and his administration, especially since the US leader issued strong support after Khashoggi was murdered.

""As long as they think they have the US administration in their pocket,"" said Coogle, ""they can do whatever they want.""","https://www.aljazeera.com/indepth/features/sahwa-awakening-movement-pressure-saudi-190603100555782.htmlAdam Coogle, Saudi Arabia researcher at Human Rights Watch (HRW), told Al Jazeera: ""You have serious allegations of torture by investigators.
This is something you will frequently hear from other human rights activists as well.""
""Most human rights activists and dissidents are in [both] Mabahith-run prisons or general prisons,"" Yahya Assiri, a Saudi activist who founded the human rights organisation Al Qst, told Al Jazeera.
While general prisons are run by the Ministry of Interior, maximum security prisons are headed by the police agency of the Presidency of the State Security, commonly known as the Mabahith.
""These facilities are far more outdated than maximum security prisons, and cells are often overcrowded,"" he said.","['oppressive', 'rights', 'maximum', 'witnessed', 'prisons', 'al', 'human', 'saudi', 'era', 'prison', 'activists', 'torture', 'security']",,https://www.aljazeera.com/podcasts
20,How Britain stole $45 trillion from India,Jason Hickel,"There is a story that is commonly told in Britain that the colonisation of India - as horrible as it may have been - was not of any major economic benefit to Britain itself. If anything, the administration of India was a cost to Britain. So the fact that the empire was sustained for so long - the story goes - was a gesture of Britain's benevolence.

New research by the renowned economist Utsa Patnaik - just published by Columbia University Press - deals a crushing blow to this narrative. Drawing on nearly two centuries of detailed data on tax and trade, Patnaik calculated that Britain drained a total of nearly $45 trillion from India during the period 1765 to 1938.

It's a staggering sum. For perspective, $45 trillion is 17 times more than the total annual gross domestic product of the United Kingdom today.

How did this come about?

It happened through the trade system. Prior to the colonial period, Britain bought goods like textiles and rice from Indian producers and paid for them in the normal way - mostly with silver - as they did with any other country. But something changed in 1765, shortly after the East India Company took control of the subcontinent and established a monopoly over Indian trade.

Here's how it worked. The East India Company began collecting taxes in India, and then cleverly used a portion of those revenues (about a third) to fund the purchase of Indian goods for British use. In other words, instead of paying for Indian goods out of their own pocket, British traders acquired them for free, ""buying"" from peasants and weavers using money that had just been taken from them.

It was a scam - theft on a grand scale. Yet most Indians were unaware of what was going on because the agent who collected the taxes was not the same as the one who showed up to buy their goods. Had it been the same person, they surely would have smelled a rat.

Some of the stolen goods were consumed in Britain, and the rest were re-exported elsewhere. The re-export system allowed Britain to finance a flow of imports from Europe, including strategic materials like iron, tar and timber, which were essential to Britain's industrialisation. Indeed, the Industrial Revolution depended in large part on this systematic theft from India.

On top of this, the British were able to sell the stolen goods to other countries for much more than they ""bought"" them for in the first place, pocketing not only 100 percent of the original value of the goods but also the markup.

After the British Raj took over in 1858, colonisers added a special new twist to the tax-and-buy system. As the East India Company's monopoly broke down, Indian producers were allowed to export their goods directly to other countries. But Britain made sure that the payments for those goods nonetheless ended up in London.

How did this work? Basically, anyone who wanted to buy goods from India would do so using special Council Bills - a unique paper currency issued only by the British Crown. And the only way to get those bills was to buy them from London with gold or silver. So traders would pay London in gold to get the bills, and then use the bills to pay Indian producers. When Indians cashed the bills in at the local colonial office, they were ""paid"" in rupees out of tax revenues - money that had just been collected from them. So, once again, they were not in fact paid at all; they were defrauded.

Meanwhile, London ended up with all of the gold and silver that should have gone directly to the Indians in exchange for their exports.

This corrupt system meant that even while India was running an impressive trade surplus with the rest of the world - a surplus that lasted for three decades in the early 20th century - it showed up as a deficit in the national accounts because the real income from India's exports was appropriated in its entirety by Britain.

Some point to this fictional ""deficit"" as evidence that India was a liability to Britain. But exactly the opposite is true. Britain intercepted enormous quantities of income that rightly belonged to Indian producers. India was the goose that laid the golden egg. Meanwhile, the ""deficit"" meant that India had no option but to borrow from Britain to finance its imports. So the entire Indian population was forced into completely unnecessary debt to their colonial overlords, further cementing British control.

Britain used the windfall from this fraudulent system to fuel the engines of imperial violence - funding the invasion of China in the 1840s and the suppression of the Indian Rebellion in 1857. And this was on top of what the Crown took directly from Indian taxpayers to pay for its wars. As Patnaik points out, ""the cost of all Britain's wars of conquest outside Indian borders were charged always wholly or mainly to Indian revenues.""

And that's not all. Britain used this flow of tribute from India to finance the expansion of capitalism in Europe and regions of European settlement, like Canada and Australia. So not only the industrialisation of Britain but also the industrialisation of much of the Western world was facilitated by extraction from the colonies.

Patnaik identifies four distinct economic periods in colonial India from 1765 to 1938, calculates the extraction for each, and then compounds at a modest rate of interest (about 5 percent, which is lower than the market rate) from the middle of each period to the present. Adding it all up, she finds that the total drain amounts to $44.6 trillion. This figure is conservative, she says, and does not include the debts that Britain imposed on India during the Raj.

These are eye-watering sums. But the true costs of this drain cannot be calculated. If India had been able to invest its own tax revenues and foreign exchange earnings in development - as Japan did - there's no telling how history might have turned out differently. India could very well have become an economic powerhouse. Centuries of poverty and suffering could have been prevented.

All of this is a sobering antidote to the rosy narrative promoted by certain powerful voices in Britain. The conservative historian Niall Ferguson has claimed that British rule helped ""develop"" India. While he was prime minister, David Cameron asserted that British rule was a net help to India.

This narrative has found considerable traction in the popular imagination: according to a 2014 YouGov poll, 50 percent of people in Britain believe that colonialism was beneficial to the colonies.

Yet during the entire 200-year history of British rule in India, there was almost no increase in per capita income. In fact, during the last half of the 19th century - the heyday of British intervention - income in India collapsed by half. The average life expectancy of Indians dropped by a fifth from 1870 to 1920. Tens of millions died needlessly of policy-induced famine.

Britain didn't develop India. Quite the contrary - as Patnaik's work makes clear - India developed Britain.

What does this require of Britain today? An apology? Absolutely. Reparations? Perhaps - although there is not enough money in all of Britain to cover the sums that Patnaik identifies. In the meantime, we can start by setting the story straight. We need to recognise that Britain retained control of India not out of benevolence but for the sake of plunder and that Britain's industrial rise didn't emerge sui generis from the steam engine and strong institutions, as our schoolbooks would have it, but depended on violent theft from other lands and other peoples.

Editor's note: A previous version of this article erroneously had the beginning of the British Raj as 1847. The correct year is 1858.

The views expressed in this article are the author's own and do not necessarily reflect Al Jazeera's editorial stance.","Drawing on nearly two centuries of detailed data on tax and trade, Patnaik calculated that Britain drained a total of nearly $45 trillion from India during the period 1765 to 1938.
The East India Company began collecting taxes in India, and then cleverly used a portion of those revenues (about a third) to fund the purchase of Indian goods for British use.
As the East India Company's monopoly broke down, Indian producers were allowed to export their goods directly to other countries.
So traders would pay London in gold to get the bills, and then use the bills to pay Indian producers.
This figure is conservative, she says, and does not include the debts that Britain imposed on India during the Raj.","['india', 'indian', 'producers', '45', 'goods', 'britain', 'system', 'patnaik', 'trillion', 'indians', 'bills', 'stole', 'british']",,https://www.aljazeera.com
