,Title,Authors,Text,Summary,Keywords,published_date,Source
0,"Millennials ‘Make Farming Sexy’ in Africa, Where Tilling the Soil Once Meant Shame",Sarah Maslin Nir,"In cuff links and tie, seated in his mansion in Accra, Richard Nunekpeku, 34, wants to project what this new breed of agripreneur can achieve. Five years ago, he left a high-paying job as an international marketing manager for Samsung to raise fowl, cereals and vegetables through a cooperative, Anyako Farms.

It hasn’t been easy. His first year, he invested nearly $80,000 in planting maize — but without irrigation, a dry spell wiped out the crop. The harvest earned just $8,000.

Drawing on his corporate background, Mr. Nunekpeku started over, hiring researchers in soils and fertilizer, and investing in high-tech irrigation. This year his farm is on track to break even for the first time, he said.

A boom in technology that aims to increase productivity is helping make agriculture more modern and lucrative. The number of agricultural technology start-ups in Africa has grown significantly from 2016 to 2018, according to a report by Disrupt Africa, a technology news site.

For some young farmers, it is not enough just to lure their peers into the sector. Nana Adjoa A. Sifa, 31, who has a degree in psychology, wants to utterly change how farming is done.

After years of working to engage youth and women in farming, she became a farmer herself. And she uses no pesticides on her farm, Guzakuza, planting mutually beneficial vegetables on a single plot.

“I want to transform mind-sets, and Africa,” Ms. Sifa said, holding an organic carrot seedling. “If we fail, it means the industry has failed. It means we have failed many young people.”","In cuff links and tie, seated in his mansion in Accra, Richard Nunekpeku, 34, wants to project what this new breed of agripreneur can achieve.
His first year, he invested nearly $80,000 in planting maize — but without irrigation, a dry spell wiped out the crop.
The number of agricultural technology start-ups in Africa has grown significantly from 2016 to 2018, according to a report by Disrupt Africa, a technology news site.
Nana Adjoa A. Sifa, 31, who has a degree in psychology, wants to utterly change how farming is done.
“I want to transform mind-sets, and Africa,” Ms. Sifa said, holding an organic carrot seedling.","['tilling', 'technology', 'wants', 'sifa', 'soil', 'irrigation', 'millennials', 'africa', 'shame', 'sexy', 'vegetables', 'nunekpeku', 'means', 'meant', 'planting', 'young', 'farming']",2019-05-27 00:00:00,http://stream.aljazeera.com
1,What young Zambians have to say about making farming more attractive,Thomas Daum,"Africa has the youngest population of any continent – 60% are under age 25. While this has evoked both hope and fear, it is clear that jobs are needed for the 12 million people entering the workforce every year.

Agriculture is best suited to provide a great many jobs as it can absorb much labour, and because prospering farms trigger employment opportunities in the rest of the economy. But agriculture is often unattractive for the youth.

To lure young people into farming, policymakers and development actors emphasise the need for modern technology, including agricultural mechanisation. But surprisingly little is known about the opinion of young people in rural areas. Few have asked them what farming and rural areas need to look like to be more attractive.

I conducted a study in Zambia and asked people in rural areas aged between 12 and 20 what would make farming attractive for them. I used two research methods to explore their aspirations and perceptions: interviews as well as drawing exercises.

The results show that young people find more positive aspects in agriculture than often assumed and that the attractiveness of farming doesn’t only hinge on modern technologies. While some technologies are needed, having diverse and sustainable farms, a healthy environment and an attractive rural life is equally important.

Provided by author

The findings

Most of the people interviewed for the study were proud of the fact that they came from farming families that owned land and worked close to the nature. Ruth (15) expanded on this and said:

We do not pay for maize, land, water and fruits such as mangoes. We have nutritious food.

The respondents also commented on the attractiveness of the rural space. Asked where they want to live in the future, rural or urban, 53% preferred rural areas, because of their freedom and social networks.

In contrast, urban life was often perceived as bad, characterised by road accidents, pollution, Satanism, thieves and drunkards. According to Talunsa (15) people are “poisoned by alcohol and fight”.

Many also found farming unattractive, citing drudgery and weather dependence as reasons. They said they would rather aim for jobs with a regular salary such as teachers. Lozi (16) said:

I want to work with the government. Then I’ll get paid monthly.

Around half of the respondents preferred a future in urban areas rather than in rural areas. These respondents were “pulled” away from rural areas because they were attracted by the perceived positive sides of urban areas. But they were also “pushed” away from rural areas which they associate with a lot of challenges. These included the high labour burden and risks associated with farming. This is what some of the respondents said about these “push” factors:

In the village, we always eat the same, beans and nshima, and we need to work hard.“ (Elina, 16) In the village, you can be bewitched over small disputes and the fields are very small. I prefer to live in town.” (Jakob, 15).

It’s important to note that the decision to reside either in a rural or urban area was rarely perceived as a lifetime decision. Respondents highlighted that one could work in town after harvest or for some years after school to save some money before returning to the village.

Some of my friends want to go to town but others want to stay. Of the ones who went, many came back after some years. (Alik, 14) I want to raise some money in town but then I want to move back to my village. I will bring a tractor with me and cultivate a lot of land. (Raimond, 17)

Making farming attractive

So what does farming need to look like to be attractive?

The young people provided some direction on what they thought would make rural spaces more attractive.

The most important factors were:

Modern technologies such as tractors and digital tools. But these shouldn’t be over emphasised. Low-tech solutions shouldn’t be neglected.

Non-material factors. Making agriculture attractive requires de-risking agriculture and promoting sustainable and diverse farms. These were clearly depicted in the drawings I’d asked the respondents to sketch of their ideal farm. The drawings typically showed highly diverse farms with trees, vegetables, fruits and animals.

Ensure healthy landscapes. Having a sustainable, pollution free environment was commonly mentioned as a key advantage of rural over urban life.

Rural areas must be developed in ways that go beyond just infrastructure. Social life and networks, which are still an asset in villages compared to cities, were also cited as important. This included networks of neighbours, relatives and friend and the communal celebration of traditions.

What next

Policymakers often highlight the need for modern technologies – including information, communication and technology – when discussing rural development.

But the young respondents I spoke to emphasised more low-tech solutions such as increasing farm diversity, having water wells and using draught animals, which is already an advantage over manual labour.

This suggests that policymakers and development practitioners need to pay more attention to the actual aspirations of young people in rural areas to avoid well-intended but misguided policies. In addition, the findings suggest that there is a need for several policies to reflect several types of young people in rural areas.","But surprisingly little is known about the opinion of young people in rural areas.
Few have asked them what farming and rural areas need to look like to be more attractive.
I conducted a study in Zambia and asked people in rural areas aged between 12 and 20 what would make farming attractive for them.
These respondents were “pulled” away from rural areas because they were attracted by the perceived positive sides of urban areas.
(Raimond, 17)Making farming attractiveSo what does farming need to look like to be attractive?","['areas', 'urban', 'farms', 'say', 'town', 'making', 'rural', 'attractive', 'need', 'zambians', 'technologies', 'young', 'farming', 'respondents']",2019-04-22 08:42:16+00:00,http://stream.aljazeera.com
2,Ugandan firm uses blockchain to trace coffee from farms to stores,Elias Biryabarema,"KAMPALA (Reuters) - An Ugandan company has started using blockchain, the technology behind virtual currency Bitcoin, to certify shipments of coffee to try to meet growing demand from consumers for more information about where products have come from.

FILE PHOTO: A worker displays washed and fermented coffee beans as they dry on coffee beds at the Tilamo cooperative of Shebedino district in Sidama, Ethiopia November 29, 2018.. REUTERS/Maheder Haileselassie/File Photo

Carico Café Connoisseur said the move could help to boost farmers’ incomes, as consumers are usually prepared to pay more for goods that can been traced back to their origins.

Blockchain works by providing a shared record of data held by a network of individual computers rather than a single party. Its supporters say this makes it hard to tamper with, and so a secure way to track goods along the supply chain

Carico Café Connoisseur CEO Mwambu Wanendeya told Reuters a blockchain-certified shipment of one of its coffee products, Bugisu Blue, arrived in South Africa last month. He declined to give the size of the shipment, but said it was several tonnes.

Uganda is Africa’s largest coffee exporter followed by Ethiopia, according to the International Coffee Organisation, and has some of the world’s highest quality beans. It predominantly cultivates the robusta variety, but also has extensive fields of arabica trees.

Limited domestic processing capacity means the country exports nearly all of its beans in raw form.

The blockchain certification means consumers can trace the coffee’s journey by using their smartphones to scan the product’s QR codes or via the certification site provenance.org.

Every step of the beans’ journey - from when farmers drop them off at collection centers to warehousing, inspection by regulators and shipping - is recorded.

“The idea is to give the consumer an appreciation of what happens on the journey and also to ensure that there’s more linkages with the farmer,” Wanendeya said.

“Traceability is important because people are increasingly concerned that ... farmers get rewarded for their work.”

The process will provide consumers with information such as the type of coffee bean, the year it was harvested, and where it was grown.

Founded in 2016, Carico Café is working with two farmer cooperatives with hundreds of members. Wanendeya predicted the innovation could boost farmers’ incomes by 10 percent.

“Consumers are willing to pay more if they can know where exactly the coffee is coming from,” he said.

Uganda is keen to increase coffee exports from the current level of around 4 million 60-kilogramme bags per year.

However, a seedlings distribution program it hoped would boost production has yielded modest results, in part because of a decline in interest in coffee among farmers due to often low and unstable prices.","Blockchain works by providing a shared record of data held by a network of individual computers rather than a single party.
Uganda is Africa’s largest coffee exporter followed by Ethiopia, according to the International Coffee Organisation, and has some of the world’s highest quality beans.
The blockchain certification means consumers can trace the coffee’s journey by using their smartphones to scan the product’s QR codes or via the certification site provenance.org.
Every step of the beans’ journey - from when farmers drop them off at collection centers to warehousing, inspection by regulators and shipping - is recorded.
Wanendeya predicted the innovation could boost farmers’ incomes by 10 percent.","['stores', 'coffee', 'beans', 'trace', 'farms', 'ugandan', 'products', 'journey', 'blockchain', 'wanendeya', 'using', 'café', 'farmers', 'boost', 'firm', 'consumers', 'uses']",2019-01-23 16:16:50+00:00,http://stream.aljazeera.com
3,Ugandan firm uses blockchain to trace coffee from farms to stores,Min Read,"KAMPALA (Reuters) - An Ugandan company has started using blockchain, the technology behind virtual currency Bitcoin, to certify shipments of coffee to try to meet growing demand from consumers for more information about where products have come from.

FILE PHOTO: A worker displays washed and fermented coffee beans as they dry on coffee beds at the Tilamo cooperative of Shebedino district in Sidama, Ethiopia November 29, 2018.. REUTERS/Maheder Haileselassie/File Photo

Carico Café Connoisseur said the move could help to boost farmers’ incomes, as consumers are usually prepared to pay more for goods that can been traced back to their origins.

Blockchain works by providing a shared record of data held by a network of individual computers rather than a single party. Its supporters say this makes it hard to tamper with, and so a secure way to track goods along the supply chain

Carico Café Connoisseur CEO Mwambu Wanendeya told Reuters a blockchain-certified shipment of one of its coffee products, Bugisu Blue, arrived in South Africa last month. He declined to give the size of the shipment, but said it was several tonnes.

Uganda is Africa’s largest coffee exporter followed by Ethiopia, according to the International Coffee Organisation, and has some of the world’s highest quality beans. It predominantly cultivates the robusta variety, but also has extensive fields of arabica trees.

Limited domestic processing capacity means the country exports nearly all of its beans in raw form.

The blockchain certification means consumers can trace the coffee’s journey by using their smartphones to scan the product’s QR codes or via the certification site provenance.org.

Every step of the beans’ journey - from when farmers drop them off at collection centers to warehousing, inspection by regulators and shipping - is recorded.

“The idea is to give the consumer an appreciation of what happens on the journey and also to ensure that there’s more linkages with the farmer,” Wanendeya said.

“Traceability is important because people are increasingly concerned that ... farmers get rewarded for their work.”

The process will provide consumers with information such as the type of coffee bean, the year it was harvested, and where it was grown.

Founded in 2016, Carico Café is working with two farmer cooperatives with hundreds of members. Wanendeya predicted the innovation could boost farmers’ incomes by 10 percent.

“Consumers are willing to pay more if they can know where exactly the coffee is coming from,” he said.

Uganda is keen to increase coffee exports from the current level of around 4 million 60-kilogramme bags per year.

However, a seedlings distribution program it hoped would boost production has yielded modest results, in part because of a decline in interest in coffee among farmers due to often low and unstable prices.","Blockchain works by providing a shared record of data held by a network of individual computers rather than a single party.
Uganda is Africa’s largest coffee exporter followed by Ethiopia, according to the International Coffee Organisation, and has some of the world’s highest quality beans.
The blockchain certification means consumers can trace the coffee’s journey by using their smartphones to scan the product’s QR codes or via the certification site provenance.org.
Every step of the beans’ journey - from when farmers drop them off at collection centers to warehousing, inspection by regulators and shipping - is recorded.
Wanendeya predicted the innovation could boost farmers’ incomes by 10 percent.","['stores', 'coffee', 'beans', 'trace', 'farms', 'ugandan', 'products', 'journey', 'blockchain', 'wanendeya', 'using', 'café', 'farmers', 'boost', 'firm', 'consumers', 'uses']",2019-01-23 16:16:50+00:00,http://stream.aljazeera.com
4,Qatar: Beyond the Blockade,Ghanem Al Sulaiti,"A look at the effect of the GCC crisis and how it's affecting life in Qatar - from family ties, to business, to art.

On June 5th, 2017, Saudi Arabia, the United Arab Emirates (UAE), Bahrain and Egypt imposed a blockade on Qatar - closing their land, air and sea borders with it - accusing it of funding ""terrorism"" and fomenting regional instability.

The Saudi, Emirati and Bahraini governments told their citizens to return from Qatar. They also asked Qatari citizens who were visiting, studying or living in their respective countries, to leave for Qatar within 14 days.

This diplomatic move left Qatar partially isolated - economically, politically and culturally.

""We saw the news and thought it's just a political thing and it will be over in a while. Everything will be back to normal,"" recalls Mohammad Awais Shafeeq, a businessman of Pakistani descent, born and raised in Qatar.

As this crisis continues without a solution, this film follows several people in Qatar to find out how they are facing up to life under blockade.

Lulwa al-Obaidli is a Qatari entrepreneur who has founded a number of different businesses.

Her potato-based snack business has suffered from the blockade, forcing her to downsize and look for new sources of potatoes and the customised flavourings. She has also felt the effect of the blockade on a personal level, with her siblings in the UAE seldom even communicating with her.

""It's killing me that my brother is getting married and I can't be there ... Do you know how painful it is when you can't even contact your own family?"" says Lulwa. ""I remember during Eid celebrations, [my brother] Abdulrahman only sent a text saying 'Eid Mubarak'. Not even a phone call.""

Countries grow in crises, people grow in crises and we grew. Qatar has become stronger, Qatar has become more united. Ghanem Al Sulaiti, Qatari actor and playwright

Meanwhile, Alanood Al-Jalahma, a university student in Qatar, worries she will have to leave the country she calls home. Born to a Bahraini father and a Qatari mother, she has lived in Qatar ever since her parents' divorce when she was four years old.

Alanood, however, only has her father's Bahraini citizenship. In all the GCC countries, citizenship is passed from father to child, so Alanood and her siblings are facing a dilemma: to leave their mother, university and home or potentially lose their only citizenship.

""All our memories, all our friends, all our family [are in Qatar],"" says Alanood. ""So to be forced to leave would be awful.""

Stories like these have inspired famous Qatari actor Ghanem al-Sulaiti to come out of a years' long hiatus to write a series of satirical sketches mocking the absurdity of the blockade.

""What's Happening?"" started as a series of sketches on YouTube and quickly became popular, gaining over two million hits - half of which are tracked to have come from audiences in the blockading countries.

He sees his political satire as a way to allow people to both laugh and lament at the Gulf diplomatic crisis. The film follows al-Sulaiti as he prepares for his recent play for a run at Qatar National Theatre on the same subject.

""My goals are simple. I want to restore our balance. To mock and laugh at what happened and to mourn what happened. But my biggest goal is to document this for future generations,"" al-Sulaiti says.

Source: Al Jazeera","A look at the effect of the GCC crisis and how it's affecting life in Qatar - from family ties, to business, to art.
On June 5th, 2017, Saudi Arabia, the United Arab Emirates (UAE), Bahrain and Egypt imposed a blockade on Qatar - closing their land, air and sea borders with it - accusing it of funding ""terrorism"" and fomenting regional instability.
They also asked Qatari citizens who were visiting, studying or living in their respective countries, to leave for Qatar within 14 days.
As this crisis continues without a solution, this film follows several people in Qatar to find out how they are facing up to life under blockade.
Qatar has become stronger, Qatar has become more united.","['leave', 'crisis', 'family', 'university', 'qatari', 'bahraini', 'alsulaiti', 'blockade', 'alanood', 'qatar']",,http://stream.aljazeera.com
5,The Trump Show,Dan Mcadams,"A look at the blurred lines between Donald Trump, reality TV star and Donald Trump, President of the United States.

From his long, unwieldy press conferences to the nomination of a Supreme Court Justice in prime time, Donald Trump delivers on spectacle.

He's an authentic fake, I think he really is. He has taken the role on so much that Donald Trump is always playing Donald Trump. Dan McAdams, psychology professor, Northwestern University

There is conflict, there is humiliation, and there is supreme confidence - dramatic elements pulled straight out of a reality TV playbook that for Trump has been years in the making. The Apprentice, a show fronted and co-produced by Donald Trump, established him as a gospel of success, despite being plagued by bankruptcy and scandal.

Building on this image, and through similar projects, Trump has arguably become a brand unto himself, endearing himself to a segment of the American public that supported him all the way to the White House.

Now in the early days of his presidency, the showmanship continues, as 24-hour news channels race to cover his every move. Is Donald Trump in his own reality show? And what does it mean for the United States?

Josh Rushing explores Trump's reality TV rise from a C-list New York celebrity to the most powerful office in the world.

Source: Al Jazeera","A look at the blurred lines between Donald Trump, reality TV star and Donald Trump, President of the United States.
From his long, unwieldy press conferences to the nomination of a Supreme Court Justice in prime time, Donald Trump delivers on spectacle.
He has taken the role on so much that Donald Trump is always playing Donald Trump.
The Apprentice, a show fronted and co-produced by Donald Trump, established him as a gospel of success, despite being plagued by bankruptcy and scandal.
Is Donald Trump in his own reality show?","['united', 'trump', 'donald', 'white', 'way', 'worldsource', 'reality', 'supreme', 'york', 'tv']",,http://stream.aljazeera.com
